{"contract":"ONSURE_EXECUTION_IDENTITY_V2_CANDIDATE","execution_id":"exec-001","target":{"id":"target-001","sha256":"aaaaaaaaaaaaaaaaaaaaaaaaaaaaaaaaaaaaaaaaaaaaaaaaaaaaaaaaaaaaaaaa"},"fixture":{"id":"fixture-001","sha256":"bbbbbbbbbbbbbbbbbbbbbbbbbbbbbbbbbbbbbbbbbbbbbbbbbbbbbbbbbbbbbbbb"},"command":{"executable":"bash","executable_sha256":"cccccccccccccccccccccccccccccccccccccccccccccccccccccccccccccccc","script_or_entry":"scripts/test.sh","script_or_entry_sha256":"dddddddddddddddddddddddddddddddddddddddddddddddddddddddddddddddd","working_directory_digest":"eeeeeeeeeeeeeeeeeeeeeeeeeeeeeeeeeeeeeeeeeeeeeeeeeeeeeeeeeeeeeeee"},"oracle":{"id":"oracle-001","sha256":"ffffffffffffffffffffffffffffffffffffffffffffffffffffffffffffffff"},"validator":{"id":"validator-001","sha256":"1111111111111111111111111111111111111111111111111111111111111111"},"environment":{"environment_digest":"2222222222222222222222222222222222222222222222222222222222222222","toolchain_digest":"3333333333333333333333333333333333333333333333333333333333333333","sandbox_profile_digest":"4444444444444444444444444444444444444444444444444444444444444444","network_policy_digest":"5555555555555555555555555555555555555555555555555555555555555555"},"policy":{"scope_epoch":"scope-1","requirement_epoch":"req-1","denominator_epoch":"denom-1","policy_epoch":"policy-1"},"authority":{"principal_profile_sha256":"6666666666666666666666666666666666666666666666666666666666666666","authority_epoch":"auth-1","purpose":"VALIDATION"},"attempt":{"attempt_id":"attempt-001","attempt_number":1,"previous_attempt_sha256":null,"retry_reason":null},"identity_digest":"7777777777777777777777777777777777777777777777777777777777777777","created_at":"2026-08-11T14:00:00Z"}
